{
  "case_id": "prompt_draft_character_surface",
  "metadata": {
    "expected_choice_ids": ["박수", "산적"],
    "surface_kind": "character_pick"
  },
  "messages": [
    {
      "type": "prompt",
      "seq": 81,
      "session_id": "sess_prompt_surface",
      "server_time_ms": 81,
      "payload": {
        "request_id": "req_draft_character_surface_1",
        "request_type": "draft_card",
        "player_id": 1,
        "timeout_ms": 30000,
        "legal_choices": [
          {
            "choice_id": "박수",
            "title": "박수",
            "description": "Select 박수 for your draft pool."
          },
          {
            "choice_id": "산적",
            "title": "산적",
            "description": "Select 산적 for your draft pool."
          }
        ],
        "public_context": {
          "draft_phase": 1,
          "draft_phase_label": "1차 드래프트",
          "offered_count": 2
        }
      }
    }
  ],
  "expected": {
    "prompt": {
      "active": {
        "surface": {
          "kind": "character_pick",
          "blocks_public_events": true,
          "character_pick": {
            "phase": "draft",
            "draft_phase": 1,
            "draft_phase_label": "1차 드래프트",
            "choice_count": 2,
            "options": [
              {
                "choice_id": "박수",
                "name": "박수",
                "description": "Select 박수 for your draft pool."
              },
              {
                "choice_id": "산적",
                "name": "산적",
                "description": "Select 산적 for your draft pool."
              }
            ]
          }
        }
      }
    }
  }
}
